{
  "evidence": {
    "commit": "1ae94c2",
    "orca": {
      "dispatches": [
        "ctx_83d335886a01",
        "ctx_470c3244d44c"
      ],
      "run": "run_1614b5c068d1",
      "tasks": [
        "task_f11bea3f1798",
        "task_a609323a8ced"
      ]
    },
    "reports": [
      ".sopify/plan/20261020_sopify_narrow_focus/audits/w5/bundle-diag-codex.md",
      ".sopify/plan/20261020_sopify_narrow_focus/audits/w5/bind-fix-codex.md"
    ],
    "result": "shared header and Cursor rule name the installed bootstrap helper and writer import; Copilot flatten drops them; path-consistency test for every host with a payload; install summary in plain words",
    "tasks": [
      "T3b"
    ],
    "tests": {
      "isolated_full": "420 passed, 97 subtests passed",
      "isolated_preflight": "All checks passed"
    }
  },
  "provenance": {
    "executor": "codex",
    "host": "claude-code",
    "plan_id": "20261020_sopify_narrow_focus",
    "plan_version": "sha256:ce988933988521e04e9a9d3f762f03f6b4654bbfa78729b265530484d052cccf",
    "receipt_id": "exec_006",
    "timestamp": "2026-10-21T02:53:40+00:00",
    "written_by": "plan owner"
  },
  "timestamp": "2026-10-21T02:53:40+00:00",
  "verdict": "implemented"
}
