{
  "evidence": {
    "codex_registration": "enabled and dry-run noop",
    "docs_sync": "completed",
    "full_tests": "219 passed; 30 passed subtests",
    "independent_review": "4 findings resolved",
    "mcp_stdio_smoke": "passed",
    "targeted_tests": "24 passed; 2 passed subtests",
    "verification_receipt": "receipts/verify_002.json"
  },
  "provenance": {
    "host": "codex",
    "phase": "post_archive_audit_fix",
    "plan_id": "20260626_mcp_tool_plane_pilot",
    "receipt_id": "final"
  },
  "timestamp": "2026-07-16T14:24:19+00:00",
  "verdict": "finalized"
}
