{
  "evidence": {
    "commands": [
      "python3.11 -m pytest tests -v",
      "sopify_protocol_check.py new-plan",
      "sopify_protocol_check.py continuation",
      "sopify_protocol_check.py finalize",
      "git diff --check"
    ],
    "result": "passed",
    "retry_count": 1,
    "retry_reason": "updated six intentional host prompt golden hashes after the first full run",
    "review_result": {
      "code_quality": "passed: local documentation edits and existing golden mechanism; no new framework",
      "spec_compliance": "passed: public docs and blueprint preserve only the agreed stable boundaries"
    },
    "tasks": [
      "4.1"
    ],
    "test_result": "225 passed, 34 subtests passed",
    "verification_source": "project_contract",
    "wave": 5
  },
  "provenance": {
    "host": "codex",
    "plan_id": "20260717_sopify_entry_preflight",
    "receipt_id": "verify_003",
    "session_id": "019f6df6-83c0-7b73-87ec-5401ce0c843c"
  },
  "timestamp": "2026-07-17T07:52:03+00:00",
  "verdict": "passed"
}
