{
  "evidence": {
    "codex_dry_run": "noop with enabled server",
    "diff_checks": "working and staged diff checks passed",
    "full_tests": "219 passed; 30 passed subtests",
    "independent_review": "4 findings resolved with minimal changes",
    "invalid_executable": "structured JSON error",
    "mcp_preflight": "Python 3.11.13; mcp 1.28.1; FastMCP import passed",
    "mcp_stdio_smoke": "5 tools listed; tool call succeeded",
    "public_docs": "README validation passed",
    "targeted_tests": "24 passed; 2 passed subtests"
  },
  "provenance": {
    "host": "codex",
    "phase": "post_archive_audit_fix",
    "plan_id": "20260626_mcp_tool_plane_pilot",
    "receipt_id": "verify_002",
    "scope": "minimal_review_remediation"
  },
  "timestamp": "2026-07-16T14:22:06+00:00",
  "verdict": "pass"
}
